{
  "ok": true,
  "contract": "pipeline-kind-board",
  "version": "1.0.0",
  "surface": "B2_ADMIN_CRM",
  "as_of": "2026-09-25T10:00:00+07:00",
  "kind": "production",
  "label": "Sản xuất",
  "def_version": 1,
  "range": {
    "key": "30d",
    "days": 30
  },
  "view": "stage",
  "columns": [
    {
      "key": "GD1",
      "label": "1 — Khởi tạo",
      "color": "#4f46e5",
      "role_label": "Mua hàng",
      "terminal": false,
      "outcome": null,
      "count": 4,
      "stuck": 1,
      "at_risk": 1,
      "breached": 0,
      "avg_h": 21.5,
      "sub_total": 3,
      "cards": [
        {
          "run_id": 12,
          "contact_id": 9,
          "display_name": "Đơn vật tư mẫu",
          "owner_name": "Người phụ trách mẫu",
          "days_in_stage": 1.5,
          "sub_done": 1,
          "sub_total": 3,
          "sla_level": "due_24h",
          "exception_open": false,
          "lock_version": 2,
          "next_due": "2026-09-26T10:00:00+07:00"
        }
      ]
    },
    {
      "key": "GD6",
      "label": "6 — Đóng dự án",
      "color": null,
      "role_label": null,
      "terminal": true,
      "outcome": "won",
      "count": 2,
      "stuck": 0,
      "at_risk": 0,
      "breached": 0,
      "avg_h": null,
      "sub_total": 5,
      "cards": []
    }
  ],
  "outdated": {
    "count": 1,
    "cards": [
      {
        "run_id": 31,
        "contact_id": null,
        "display_name": "Dự án cũ",
        "owner_name": null,
        "days_in_stage": 12.5,
        "sub_done": 0,
        "sub_total": 0,
        "sla_level": null,
        "exception_open": false,
        "lock_version": 0,
        "next_due": null
      }
    ]
  },
  "kpis": {
    "open": 4,
    "stuck": 1,
    "no_next": 0,
    "overdue": 0,
    "breached": 0,
    "closed_in_range": 2
  },
  "matrix": [
    {
      "owner_id": null,
      "owner_label": "Chưa phân công",
      "counts": {
        "GD1": 4
      }
    }
  ]
}
